{
  "$schema": "https://whatiuse.minwookshin.com/agent/teum-agent.schema.json",
  "schemaVersion": 1,
  "version": "0.1.0-rc.29",
  "generatedBy": "scripts/build-agent-contract.mjs",
  "system": {
    "schemaVersion": 1,
    "product": "Teum",
    "principles": [
      "stable geometry",
      "shared origin",
      "reversible completion"
    ],
    "workflow": [
      "inspect project",
      "classify task",
      "select recipe",
      "verify boundaries",
      "install source",
      "compose with public APIs",
      "run quality gates"
    ],
    "qualityGates": [
      "TypeScript",
      "production build",
      "keyboard path",
      "accessible names and semantics",
      "light and dark themes",
      "reduced motion",
      "no undocumented API",
      "no forbidden-rule violation"
    ]
  },
  "components": [
    {
      "id": "button",
      "title": "Button",
      "type": "registry:ui",
      "description": "Compact action hierarchy with loading-state geometry.",
      "registryItem": "@teum/button",
      "registryDependencies": [
        "@teum/teum-base"
      ],
      "packageDependencies": [
        "@base-ui/react@^1.7.0",
        "class-variance-authority@^0.7.1"
      ],
      "useWhen": "The user needs to start or confirm a discrete action.",
      "avoidWhen": "Navigation is the intent. Use a link that can still look like a button.",
      "states": [
        "Default",
        "Hover",
        "Pressed",
        "Focus",
        "Loading",
        "Disabled",
        "Long label"
      ],
      "keyboard": [
        "Tab to focus",
        "Enter or Space to activate",
        "Focus remains while loading"
      ],
      "quality": [
        "Stable loading geometry",
        "One primary action per surface",
        "Label never wraps"
      ]
    },
    {
      "id": "icon-button",
      "title": "Icon Button",
      "type": "registry:ui",
      "description": "Accessible square icon action with tooltip support.",
      "registryItem": "@teum/icon-button",
      "registryDependencies": [
        "@teum/button",
        "@teum/tooltip"
      ],
      "packageDependencies": [],
      "useWhen": "A familiar icon can represent a frequent action in a constrained area.",
      "avoidWhen": "The icon is ambiguous without explanation. Prefer a labelled Button.",
      "states": [
        "Default",
        "Hover",
        "Pressed",
        "Focus",
        "Loading",
        "Disabled",
        "Tooltip"
      ],
      "keyboard": [
        "Tab to focus",
        "Enter or Space to activate",
        "Tooltip appears on focus"
      ],
      "quality": [
        "Accessible name required",
        "Tooltip recommended",
        "Consistent 15px glyph box"
      ]
    },
    {
      "id": "field",
      "title": "Field & Fieldset",
      "type": "registry:ui",
      "description": "Accessible labels, guidance, validation, and grouped form semantics.",
      "registryItem": "@teum/field",
      "registryDependencies": [
        "@teum/teum-base"
      ],
      "packageDependencies": [
        "@base-ui/react@^1.7.0"
      ],
      "useWhen": "A control needs a persistent label, supporting guidance, validation, or grouping semantics.",
      "avoidWhen": "The content is not form input or the label would only repeat nearby visible context.",
      "states": [
        "Default",
        "With description",
        "Focus",
        "Error",
        "Required",
        "Read only",
        "Disabled"
      ],
      "keyboard": [
        "Label activates the associated control",
        "Tab follows native form order",
        "Error and description remain referenced"
      ],
      "quality": [
        "One semantic field boundary",
        "Guidance stays stable during validation",
        "Fieldset uses a visible legend"
      ]
    },
    {
      "id": "input-group",
      "title": "Input Group",
      "type": "registry:ui",
      "description": "One text-entry boundary with contextual addons and compact actions.",
      "registryItem": "@teum/input-group",
      "registryDependencies": [
        "@teum/teum-base",
        "@teum/button"
      ],
      "packageDependencies": [],
      "useWhen": "An addon or action belongs inside the same visual entry boundary as one text input.",
      "avoidWhen": "The adjacent controls perform unrelated work or several inputs form a compound value.",
      "states": [
        "Default",
        "Leading addon",
        "Trailing action",
        "Keyboard hint",
        "Focus",
        "Error",
        "Disabled"
      ],
      "keyboard": [
        "Tab reaches the input first",
        "Trailing actions remain separately tabbable",
        "Native text editing is unchanged"
      ],
      "quality": [
        "Exactly one text input",
        "One shared focus boundary",
        "Disabled and invalid state propagate to interactive children"
      ]
    },
    {
      "id": "kbd",
      "title": "Kbd",
      "type": "registry:ui",
      "description": "Presentational keyboard hints for keys, chords, and sequences.",
      "registryItem": "@teum/kbd",
      "registryDependencies": [
        "@teum/teum-base"
      ],
      "packageDependencies": [],
      "useWhen": "A visible hint explains a real keyboard shortcut or key sequence.",
      "avoidWhen": "The key is interactive on its own or no working shortcut exists.",
      "states": [
        "Single key",
        "Modifier chord",
        "Sequence",
        "Inside button",
        "Inside input"
      ],
      "keyboard": [
        "Never enters the tab order",
        "Reading order matches activation order",
        "Shortcut behavior is documented elsewhere"
      ],
      "quality": [
        "Presentational only",
        "Compact but readable",
        "Platform notation remains consistent"
      ]
    },
    {
      "id": "button-group",
      "title": "Button Group",
      "type": "registry:ui",
      "description": "Related actions with shared rhythm and optional joined geometry.",
      "registryItem": "@teum/button-group",
      "registryDependencies": [
        "@teum/teum-base"
      ],
      "packageDependencies": [],
      "useWhen": "Two or more related actions benefit from shared alignment or joined geometry.",
      "avoidWhen": "Actions are unrelated, one action dominates an entire form, or arrow-key navigation is expected.",
      "states": [
        "Default",
        "Attached",
        "Mixed hierarchy",
        "With icon",
        "Vertical",
        "Disabled item"
      ],
      "keyboard": [
        "Group has an accessible name",
        "Each button keeps ordinary Tab behavior",
        "No implicit arrow-key navigation"
      ],
      "quality": [
        "Related actions only",
        "Joined edges do not double",
        "Hierarchy remains visible without extra borders"
      ]
    },
    {
      "id": "toolbar",
      "title": "Toolbar",
      "type": "registry:ui",
      "description": "Compact frequently used controls with roving keyboard navigation.",
      "registryItem": "@teum/toolbar",
      "registryDependencies": [
        "@teum/teum-base"
      ],
      "packageDependencies": [
        "@base-ui/react@^1.7.0"
      ],
      "useWhen": "A compact set of frequent peer controls benefits from one arrow-navigable region.",
      "avoidWhen": "Actions are infrequent, form submission is the main task, or controls need explanatory copy.",
      "states": [
        "Default",
        "Hover",
        "Focus",
        "Disabled item",
        "With popup",
        "Vertical"
      ],
      "keyboard": [
        "Tab enters once",
        "Arrow keys move between controls",
        "Home and End reach edges",
        "Popup triggers preserve toolbar navigation"
      ],
      "quality": [
        "Groups and toolbar are named",
        "One optional input appears last",
        "Icons keep specific accessible names"
      ]
    },
    {
      "id": "text-field",
      "title": "Text Field",
      "type": "registry:ui",
      "description": "Dense labelled input with hints, validation, and adornments.",
      "registryItem": "@teum/text-field",
      "registryDependencies": [
        "@teum/teum-base"
      ],
      "packageDependencies": [],
      "useWhen": "The user enters a short, unstructured value.",
      "avoidWhen": "A finite option set can be selected with less effort.",
      "states": [
        "Empty",
        "Filled",
        "Hover",
        "Focus",
        "Error",
        "Read only",
        "Disabled"
      ],
      "keyboard": [
        "Tab to focus",
        "Native text editing",
        "Error is referenced by the input"
      ],
      "quality": [
        "Persistent label",
        "Inline validation",
        "No placeholder as label"
      ]
    },
    {
      "id": "number-field",
      "title": "Number Field",
      "type": "registry:ui",
      "description": "Locale-aware bounded numeric input with direct entry and step controls.",
      "registryItem": "@teum/number-field",
      "registryDependencies": [
        "@teum/teum-base"
      ],
      "packageDependencies": [
        "@base-ui/react@^1.7.0",
        "@phosphor-icons/react@^2.1.10"
      ],
      "useWhen": "The value is numeric and stepping, bounds, or locale-aware formatting reduce entry errors.",
      "avoidWhen": "The number is an identifier, phone number, postal code, or another string that is not mathematically stepped.",
      "states": [
        "Empty",
        "Value",
        "Hover",
        "Focus",
        "Stepped",
        "Bounds",
        "Error",
        "Read only",
        "Disabled"
      ],
      "keyboard": [
        "Arrow Up and Down step",
        "Shift uses the large step",
        "Home and End reach bounds when supported"
      ],
      "quality": [
        "Native text entry remains available",
        "Buttons keep a specific accessible name",
        "Formatting never hides the raw submitted value"
      ]
    },
    {